{"authority_scope":"CONSTRUCTION_GOVERNANCE_ONLY","base_commit":"e90a717d3863e4fb0e5e1a0fcc01661f24d2157d","base_tree":"7a1ce74ad0b82c7c288b94c47c966028e916137d","candidate_binding":{"strategy":"EXACT_HEAD_AT_VALIDATION"},"canon":{"base_canon_hash":"d7ceea75615b57970f3b9712b73ed4c9f65a9c4406c877e9013470cb53a6141a","change_kind":"NONE_CONSTRUCTION_GOVERNANCE_ONLY","proposed_canon_hash":"d7ceea75615b57970f3b9712b73ed4c9f65a9c4406c877e9013470cb53a6141a","source_index_sha256":"d7ceea75615b57970f3b9712b73ed4c9f65a9c4406c877e9013470cb53a6141a"},"canonicalization_version":"1.0.0","change_set_id":"CS-R2-SC-GOV-INSTALL-001","manifest_id":"RR-SC-GOV-CANONICAL-MANIFEST-001","merkle":{"algorithm":"SHA-256-BINARY-PAIR-DUPLICATE-ODD-V1","leaf_order":"record_id_lexical","root":"5b9e417209beab3dc88ed305a79b8945512d4c0e842397e5494885ac4dd3a23e"},"r2_canon_precedence":"HIGHER","records":[{"canonical_sha256":"724614d35d775f4e29746b480183cb5fb97b7ada7c415df56154029813cb204c","record_id":"Q001","record_type":"OWNER_QA_DECISION","source_path":"governance/story-construction/decisions.q001-q130.yaml"},{"canonical_sha256":"0f23f4e1ace954ce696f3f5d36e48d305932749f89124001e6db1a87c15aad20","record_id":"Q002","record_type":"OWNER_QA_DECISION","source_path":"governance/story-construction/decisions.q001-q130.yaml"},{"canonical_sha256":"66eaa248c7750049909cd3955d2981f4e8204bc7b0d7b120305c149ef20430cd","record_id":"Q003","record_type":"OWNER_QA_DECISION","source_path":"governance/story-construction/decisions.q001-q130.yaml"},{"canonical_sha256":"9f599c8ae03a6c218055f12eed135251c0a913e1a9a80e9eecbbc34739becbab","record_id":"Q004","record_type":"OWNER_QA_DECISION","source_path":"governance/story-construction/decisions.q001-q130.yaml"},{"canonical_sha256":"8b1ed1e5ac51da2264350b7c74eaf0bf7f09447f72f97131a56e3a8795274b6c","record_id":"Q005","record_type":"OWNER_QA_DECISION","source_path":"governance/story-construction/decisions.q001-q130.yaml"},{"canonical_sha256":"e5f2a10f825faf0b97534cc89459b67213eef8cf3a50ba001afe8a95daab3690","record_id":"Q006","record_type":"OWNER_QA_DECISION","source_path":"governance/story-construction/decisions.q001-q130.yaml"},{"canonical_sha256":"f483be6a6409a2ca9db90039aab85c00da126ba0c6853b79674550a83f53d7bd","record_id":"Q007","record_type":"OWNER_QA_DECISION","source_path":"governance/story-construction/decisions.q001-q130.yaml"},{"canonical_sha256":"c5f35fa66ec70c2b5f6e8978a6ac3599344e4aba66c0646378f7640f554a4bca","record_id":"Q008","record_type":"OWNER_QA_DECISION","source_path":"governance/story-construction/decisions.q001-q130.yaml"},{"canonical_sha256":"feb3412dc065f52e5327e94eabbb8591822668cfa0f135b8be05d13cff9600d3","record_id":"Q009","record_type":"OWNER_QA_DECISION","source_path":"governance/story-construction/decisions.q001-q130.yaml"},{"canonical_sha256":"cb8c91ddf9be7fb1b4d964ad70decbf4c9a61c3b479da3d1072a8e8cff19f1af","record_id":"Q010","record_type":"OWNER_QA_DECISION","source_path":"governance/story-construction/decisions.q001-q130.yaml"},{"canonical_sha256":"03dd89345a0d5da52940a354425b116f9f9b090abccabdafb6f979ffd765cf63","record_id":"Q011","record_type":"OWNER_QA_DECISION","source_path":"governance/story-construction/decisions.q001-q130.yaml"},{"canonical_sha256":"9a97a0acec96bd186639e71fc166ccb7e84b89d8e254e4631606a309eb8acf3a","record_id":"Q012","record_type":"OWNER_QA_DECISION","source_path":"governance/story-construction/decisions.q001-q130.yaml"},{"canonical_sha256":"7536bfc310445fbb999ef6384b7c95f3c147826e994f7623d847af0bdfe98cca","record_id":"Q013","record_type":"OWNER_QA_DECISION","source_path":"governance/story-construction/decisions.q001-q130.yaml"},{"canonical_sha256":"0a3504ed1ee75456db77c5039631ecf61531e5dc3f76ac1dca3170c92291bd0d","record_id":"Q014","record_type":"OWNER_QA_DECISION","source_path":"governance/story-construction/decisions.q001-q130.yaml"},{"canonical_sha256":"2014df054b74952a9460d39ee17d626a1f4254e4b9fa85bb977884de1a21bdeb","record_id":"Q015","record_type":"OWNER_QA_DECISION","source_path":"governance/story-construction/decisions.q001-q130.yaml"},{"canonical_sha256":"cfde8b705d73e930cb85f8fe8f57776714e2332852c5d695a59126a0b527444b","record_id":"Q016","record_type":"OWNER_QA_DECISION","source_path":"governance/story-construction/decisions.q001-q130.yaml"},{"canonical_sha256":"c135d457e5317400813c84a3756538e7b6c4257a38ebb4a76d25af2b482da477","record_id":"Q017","record_type":"OWNER_QA_DECISION","source_path":"governance/story-construction/decisions.q001-q130.yaml"},{"canonical_sha256":"7df02321c53ad354dfe159d7f615703a859bfee2567144cdeb94542a08f9bfe1","record_id":"Q018","record_type":"OWNER_QA_DECISION","source_path":"governance/story-construction/decisions.q001-q130.yaml"},{"canonical_sha256":"7f35a75730e239a65fdbbfbdcb6ef752959744e26d71cb467911742dcc657911","record_id":"Q019","record_type":"OWNER_QA_DECISION","source_path":"governance/story-construction/decisions.q001-q130.yaml"},{"canonical_sha256":"9214c630f6fb5b2e513a71595e41a11a671de6ca1ecc2b4fdcf1fb57127dd4a9","record_id":"Q020","record_type":"OWNER_QA_DECISION","source_path":"governance/story-construction/decisions.q001-q130.yaml"},{"canonical_sha256":"e0272519c0e38b3cd3e4a0e91683b09c68fab48e7d0eb90ff7a62a1f486bea11","record_id":"Q021","record_type":"OWNER_QA_DECISION","source_path":"governance/story-construction/decisions.q001-q130.yaml"},{"canonical_sha256":"e66653d652d08b734959beed178539319fae26a3f435030162fafe81ab068d28","record_id":"Q022","record_type":"OWNER_QA_DECISION","source_path":"governance/story-construction/decisions.q001-q130.yaml"},{"canonical_sha256":"26eaab0bd6826bd0ef374fd61e11db130fbf012bceb873f0da350579b1110e42","record_id":"Q023","record_type":"OWNER_QA_DECISION","source_path":"governance/story-construction/decisions.q001-q130.yaml"},{"canonical_sha256":"aa3773d83086f68b9545f27d65502e8c52dd803416561e5c1c9f876b08b5429e","record_id":"Q024","record_type":"OWNER_QA_DECISION","source_path":"governance/story-construction/decisions.q001-q130.yaml"},{"canonical_sha256":"56c802d841b403ae1edcf97a9ba75205ce16da2f0a8237c6e56291d8145ebe10","record_id":"Q025","record_type":"OWNER_QA_DECISION","source_path":"governance/story-construction/decisions.q001-q130.yaml"},{"canonical_sha256":"26ecd3e0ed2550899468d6dffa1131947808a28635e869d5bedca3bc2a9e02d4","record_id":"Q026","record_type":"OWNER_QA_DECISION","source_path":"governance/story-construction/decisions.q001-q130.yaml"},{"canonical_sha256":"d003ca3ffde0a67faeb7b34d492a9e0d4aaaa0a410f78395c210ac8023f394e8","record_id":"Q027","record_type":"OWNER_QA_DECISION","source_path":"governance/story-construction/decisions.q001-q130.yaml"},{"canonical_sha256":"6888d96c231a702db0636f66cc9f60fef4429bf02222f0ae1238673e8c414f8d","record_id":"Q028","record_type":"OWNER_QA_DECISION","source_path":"governance/story-construction/decisions.q001-q130.yaml"},{"canonical_sha256":"c240f0990b451355f22374f43d7409251ae9788cee0e463dd92e3a6fbaf4cc35","record_id":"Q029","record_type":"OWNER_QA_DECISION","source_path":"governance/story-construction/decisions.q001-q130.yaml"},{"canonical_sha256":"2be8296d11df55a9199ab05edbd188acfc5c8f80f2dbc3091ab14663e42e80e1","record_id":"Q030","record_type":"OWNER_QA_DECISION","source_path":"governance/story-construction/decisions.q001-q130.yaml"},{"canonical_sha256":"d89431ecda7bb0585661221abe446323baff183b829e261fd5ed52d7d7b8ca61","record_id":"Q031","record_type":"OWNER_QA_DECISION","source_path":"governance/story-construction/decisions.q001-q130.yaml"},{"canonical_sha256":"fd7b66c936bcb53de1116eba052d183e984418869b4a956412cc64f2dd0833bf","record_id":"Q032","record_type":"OWNER_QA_DECISION","source_path":"governance/story-construction/decisions.q001-q130.yaml"},{"canonical_sha256":"149954671fb8cb8879eae408e9811ddf9781877c30e1d9f82fb31aa2d4eefba5","record_id":"Q033","record_type":"OWNER_QA_DECISION","source_path":"governance/story-construction/decisions.q001-q130.yaml"},{"canonical_sha256":"5faa42f389e8529790431acb2232aaa6db67cf4bdac0baa4c94d8b875604fb48","record_id":"Q034","record_type":"OWNER_QA_DECISION","source_path":"governance/story-construction/decisions.q001-q130.yaml"},{"canonical_sha256":"497e572eca08b2dc3d90b5c6a32ea2cda12e31db5b9200ba0db3af306e401439","record_id":"Q035","record_type":"OWNER_QA_DECISION","source_path":"governance/story-construction/decisions.q001-q130.yaml"},{"canonical_sha256":"b45146a335cbf33d6b464193f77cda24358a7076082408781aa6498c0d65a537","record_id":"Q036","record_type":"OWNER_QA_DECISION","source_path":"governance/story-construction/decisions.q001-q130.yaml"},{"canonical_sha256":"1d9cea403c6f4b022ec96454cc719ffe14fa5ded05cc8c6574ce84b627bde9c8","record_id":"Q037","record_type":"OWNER_QA_DECISION","source_path":"governance/story-construction/decisions.q001-q130.yaml"},{"canonical_sha256":"fd177a4d2b22bb9bedb8829748aa775c73986babe90d478f375b816fcc83d43f","record_id":"Q038","record_type":"OWNER_QA_DECISION","source_path":"governance/story-construction/decisions.q001-q130.yaml"},{"canonical_sha256":"5bf4d1ca91355068dff936148bca265c5ac6ee217590cf77367a8fd388ecb1ca","record_id":"Q039","record_type":"OWNER_QA_DECISION","source_path":"governance/story-construction/decisions.q001-q130.yaml"},{"canonical_sha256":"40619a03fbd446f3c2b3975e1db451e608b4cc9a6e3b9d6349febaad7be66a02","record_id":"Q040","record_type":"OWNER_QA_DECISION","source_path":"governance/story-construction/decisions.q001-q130.yaml"},{"canonical_sha256":"5befb4a689c513ce306b454b93a8c45df93060e815db4680c4180001b069cb94","record_id":"Q041","record_type":"OWNER_QA_DECISION","source_path":"governance/story-construction/decisions.q001-q130.yaml"},{"canonical_sha256":"ac131040c72cc33bb0e3f22a050d06f19b499471582475617532dfd387d48313","record_id":"Q042","record_type":"OWNER_QA_DECISION","source_path":"governance/story-construction/decisions.q001-q130.yaml"},{"canonical_sha256":"8f314985a57b6ebac4ba28bc6f67bdc381d6674c98a5260238ad5c6338dc4457","record_id":"Q043","record_type":"OWNER_QA_DECISION","source_path":"governance/story-construction/decisions.q001-q130.yaml"},{